{
  "kind": "sut_tick_hang",
  "process_id": "proc_123",
  "tick_id": "tick_46",
  "started_at": "2026-06-13T18:10:00Z",
  "observed_at": "2026-06-13T18:11:00Z",
  "duration_ms": 60000,
  "previous_artifact_hash": "sha256:aaaaaaaaaaaaaaaaaaaaaaaaaaaaaaaaaaaaaaaaaaaaaaaaaaaaaaaaaaaaaaaa",
  "current_artifact_hash": "sha256:bbbbbbbbbbbbbbbbbbbbbbbbbbbbbbbbbbbbbbbbbbbbbbbbbbbbbbbbbbbbbbbb",
  "retry_count": 0
}
